{
  "schemaVersion": "0.1.0-draft.3",
  "backupId": "backup.demo.001",
  "projectId": "project.demo",
  "contractVersion": "0.1.0-draft.3",
  "backupType": "full",
  "generation": 1,
  "createdAt": "2026-07-12T13:00:00Z",
  "createdBy": {
    "principalId": "principal.owner",
    "sessionId": "session.owner.001",
    "hostId": "host.demo"
  },
  "sourceHostId": "host.demo",
  "sourceCommit": "68ac195d1f6cc86d048a570bb053350419e7dbe5",
  "dirty": false,
  "consistency": {
    "quiesced": true,
    "eventSequence": 42,
    "databaseCheckpoint": "sqlite-checkpoint-42"
  },
  "contents": [
    {
      "name": "source.bundle",
      "kind": "git_bundle",
      "sizeBytes": 2048,
      "sha256": "3333333333333333333333333333333333333333333333333333333333333333",
      "sensitivity": "internal"
    },
    {
      "name": "state.snapshot.enc",
      "kind": "state_snapshot",
      "sizeBytes": 4096,
      "sha256": "4444444444444444444444444444444444444444444444444444444444444444",
      "sensitivity": "confidential"
    },
    {
      "name": "audit.events.jsonl.enc",
      "kind": "audit_mirror",
      "sizeBytes": 1024,
      "sha256": "5555555555555555555555555555555555555555555555555555555555555555",
      "sensitivity": "confidential"
    }
  ],
  "encryption": {
    "mode": "aes-256-gcm",
    "keyRef": "bridge-key://backup/demo-001",
    "wrappedKeyCapsule": {
      "capsuleRef": "drive://recovery-key-account/bridge2/key-capsules/demo-001.wrap",
      "storageAccountRef": "drive-account://recovery-key-account",
      "wrappingAlgorithmId": "owner-policy-pending",
      "recoveryProcedureRef": "drive://recovery-key-account/bridge2/KEY-RECOVERY.md",
      "decryptionSecretCustody": "outside_drive_and_github"
    }
  },
  "destinations": [
    {
      "kind": "drive",
      "uri": "file:///C:/Drive/Bridge2Recovery/backups/backup.demo.001",
      "status": "pending"
    }
  ]
}
